{
  "settingId": "spuk_im_schlosskeller",
  "pfad": "ahmet",
  "hinweis": "Tatnacht im Pfad Ahmet. Ersetzt den Plan von Ahmet aus basis.json und ergänzt Ereignisse und Gegenstandsspuren. Alle anderen Personen handeln wie in basis.json.",
  "plaene": {
    "ahmet": [
      {
        "t": "23:50:00",
        "ort": "vor_theke",
        "haltung": "steht"
      },
      {
        "t": "23:53:00",
        "nach": "am_handykorb",
        "bis": "23:53:30",
        "tempo": "gehen"
      },
      {
        "t": "23:55:10",
        "nach": "am_jackenstaender",
        "bis": "23:55:30",
        "tempo": "gehen"
      },
      {
        "t": "23:56:50",
        "nach": "hinter_theke_ost",
        "bis": "23:56:58",
        "tempo": "gehen"
      },
      {
        "t": "23:58:00",
        "haltung": "kauert"
      },
      {
        "t": "23:58:03",
        "sagt": "Damir? Ich bin's, Ahmet.",
        "lautstaerke": "leise"
      },
      {
        "t": "23:58:30",
        "nach": "vor_vorratstuer",
        "bis": "23:58:35",
        "tempo": "gehen",
        "haltung": "steht"
      },
      {
        "t": "23:58:35",
        "sagt": "Bitte, sag um zwölf nichts. Ich geb allen das Geld zurück.",
        "lautstaerke": "leise"
      },
      {
        "t": "23:58:41",
        "nach": "vorrat_innen",
        "bis": "23:58:43",
        "tempo": "gehen"
      },
      {
        "t": "23:58:46",
        "nach": "am_jackenstaender",
        "bis": "23:58:58",
        "tempo": "gehen",
        "ueber": [
          "vor_vorratstuer",
          "hinter_theke_ost"
        ]
      },
      {
        "t": "23:59:02",
        "nach": "hinter_theke_ost",
        "bis": "23:59:08",
        "tempo": "gehen",
        "haltung": "kauert"
      },
      {
        "t": "23:59:10",
        "sagt": "Damir, ich bin's wieder.",
        "lautstaerke": "leise"
      },
      {
        "t": "00:00:05",
        "haltung": "steht"
      },
      {
        "t": "00:11:00",
        "nach": "am_kamin",
        "bis": "00:11:40",
        "tempo": "gehen",
        "ueber": [
          "theke_klappe",
          "durchgang_mitte"
        ]
      },
      {
        "t": "00:12:00",
        "geraeusch": "Papier raschelt im Ascheneimer",
        "lautstaerke": "leise"
      },
      {
        "t": "00:12:20",
        "nach": "vor_theke",
        "bis": "00:13:00",
        "tempo": "gehen",
        "ueber": [
          "durchgang_mitte",
          "theke_klappe"
        ]
      }
    ]
  },
  "ereignisse": [
    {
      "id": "ev_can_gepackt",
      "t": "23:58:13",
      "ort": "vor_vorratstuer",
      "art": "handlung",
      "person": "schneider",
      "ziel": "can",
      "text": "Herr Schneider packt Can an der Kapuze."
    },
    {
      "id": "ev_can_losgerissen",
      "t": "23:58:28",
      "ort": "vor_vorratstuer",
      "art": "handlung",
      "person": "can",
      "text": "Can reißt sich los und rennt mit der leuchtenden Maske in der Hand davon."
    },
    {
      "id": "ev_ahmet_gepackt",
      "t": "23:58:36",
      "ort": "vor_vorratstuer",
      "art": "handlung",
      "person": "schneider",
      "ziel": "ahmet",
      "text": "Herr Schneider packt Ahmet am Arm."
    },
    {
      "id": "ev_ahmet_schlag",
      "t": "23:58:39",
      "ort": "vor_vorratstuer",
      "art": "handlung",
      "person": "ahmet",
      "text": "In Panik greift Ahmet den Kerzenständer von der Anrichte und schlägt einmal zu. Rote Wachstropfen fallen auf den Umschlag in seiner Hand."
    }
  ],
  "gegenstaende": [
    {
      "id": "kerzenstaender",
      "spur": [
        {
          "t": "23:50:00",
          "einrichtung": "anrichte",
          "stelle": "auf der Anrichte neben der Vorratsraumtür"
        },
        {
          "t": "23:58:39",
          "traeger": "ahmet"
        },
        {
          "t": "23:58:40",
          "ort": "vor_vorratstuer",
          "stelle": "umgestoßen auf dem Steinboden vor der Vorratsraumtür, die Kerzen herausgefallen"
        }
      ]
    },
    {
      "id": "bund_schneider",
      "spur": [
        {
          "t": "23:50:00",
          "traeger": "schneider"
        },
        {
          "t": "23:58:45",
          "traeger": "ahmet"
        },
        {
          "t": "23:59:01",
          "einrichtung": "jackenstaender",
          "stelle": "in der Innentasche von Ahmets schwarzer Jacke am Jackenständer"
        }
      ]
    },
    {
      "id": "umschlag_mietgeld",
      "spur": [
        {
          "t": "23:50:00",
          "traeger": "ahmet"
        },
        {
          "t": "00:12:00",
          "einrichtung": "ascheneimer",
          "stelle": "leer im Ascheneimer neben der Kamin-Nische"
        }
      ]
    }
  ]
}