{
  "settingId": "spuk_im_schlosskeller",
  "pfad": "can",
  "hinweis": "Tatnacht im Pfad Can. Ersetzt den Plan von Can aus basis.json und ergänzt Ereignisse und Gegenstandsspuren. Alle anderen Personen handeln wie in basis.json.",
  "plaene": {
    "can": [
      {
        "t": "23:50:00",
        "ort": "west_bank_west",
        "haltung": "sitzt"
      },
      {
        "t": "23:54:00",
        "nach": "vorrat_mitte",
        "bis": "23:54:20",
        "tempo": "gehen",
        "ueber": [
          "durchgang_mitte",
          "theke_klappe",
          "vor_vorratstuer"
        ]
      },
      {
        "t": "23:54:20",
        "licht": "licht_maske",
        "an": true
      },
      {
        "t": "23:57:00",
        "nach": "vorrat_innen",
        "bis": "23:57:03",
        "tempo": "gehen"
      },
      {
        "t": "23:58:09",
        "nach": "vor_vorratstuer",
        "bis": "23:58:11",
        "tempo": "gehen"
      },
      {
        "t": "23:58:11",
        "sagt": "Buuuh!",
        "lautstaerke": "laut"
      },
      {
        "t": "23:58:41",
        "nach": "vorrat_innen",
        "bis": "23:58:43",
        "tempo": "gehen"
      },
      {
        "t": "23:58:46",
        "nach": "vor_bogentuer",
        "bis": "23:58:53",
        "tempo": "rennen",
        "ueber": [
          "vor_vorratstuer",
          "theke_klappe",
          "durchgang_mitte"
        ]
      },
      {
        "t": "23:58:53",
        "licht": "licht_maske",
        "an": false
      },
      {
        "t": "23:58:54",
        "nach": "an_der_ruestung",
        "bis": "23:58:57",
        "tempo": "gehen"
      },
      {
        "t": "23:59:01",
        "nach": "wc",
        "bis": "23:59:16",
        "tempo": "gehen"
      },
      {
        "t": "00:01:00",
        "nach": "west_bank_west",
        "bis": "00:01:30",
        "tempo": "gehen"
      }
    ]
  },
  "ereignisse": [
    {
      "id": "ev_can_gepackt",
      "t": "23:58:13",
      "ort": "vor_vorratstuer",
      "art": "handlung",
      "person": "schneider",
      "ziel": "can",
      "text": "Herr Schneider packt Can an der Kapuze und hält ihn fest."
    },
    {
      "id": "ev_can_schlag",
      "t": "23:58:39",
      "ort": "vor_vorratstuer",
      "art": "handlung",
      "person": "can",
      "text": "In Panik greift Can mit der Hand voller Leuchtfarbe den Kerzenständer von der Anrichte und schlägt einmal zu. Rote Wachstropfen fallen auf die Maske in seiner anderen Hand."
    },
    {
      "id": "ev_can_drohung",
      "t": "23:58:31",
      "ort": "vor_vorratstuer",
      "art": "geraeusch",
      "lautstaerke": "leise",
      "person": "schneider",
      "text": "Herr Schneider zischt: „Jetzt kommt die Polizei, Freundchen.“"
    }
  ],
  "gegenstaende": [
    {
      "id": "kerzenstaender",
      "spur": [
        {
          "t": "23:50:00",
          "einrichtung": "anrichte",
          "stelle": "auf der Anrichte neben der Vorratsraumtür"
        },
        {
          "t": "23:58:39",
          "traeger": "can"
        },
        {
          "t": "23:58:40",
          "ort": "vor_vorratstuer",
          "stelle": "umgestoßen auf dem Steinboden vor der Vorratsraumtür, die Kerzen herausgefallen"
        }
      ]
    },
    {
      "id": "bund_schneider",
      "spur": [
        {
          "t": "23:50:00",
          "traeger": "schneider"
        },
        {
          "t": "23:58:45",
          "traeger": "can"
        },
        {
          "t": "23:58:59",
          "ort": "an_der_ruestung",
          "stelle": "im Helm der Ritterrüstung im Turmgang"
        }
      ]
    }
  ]
}